{"a7":{"artifact":{"path":"/srv/sparkinterval-source/a7_boundary.json","sha256":"ccc11cecdc398c9d0a9bcf2b1bd4994399557985fe17bc216f0a40eb8eb49f29","size_bytes":1494999},"flint_source_root":"/srv/sparkinterval-source/flint-3.6.0","python_flint_source_root":"/srv/sparkinterval-source/python-flint-0.9.0","python_flint_wheel":{"path":"/srv/sparkinterval-source/python_flint-0.9.0-cp310-abi3-manylinux2014_x86_64.manylinux_2_17_x86_64.whl","sha256":"376b88cacd30612479e839ffdba887599d3f9c8c0e214852bf80bb2b194e4d76","size_bytes":10125938}},"base_site":{"path":"/srv/sparkinterval-operator/site/azure-cpu-materializer-site.json","sha256":"0000000000000000000000000000000000000000000000000000000000000000","size_bytes":0},"kind":"sparkinterval.azure.cpu.a7-boundary-materializer-site.v1","schema_version":1}
